{
  "schema_version": "quality-eval-report.v1",
  "generated_from": "tools/real_srt_quality_eval.py",
  "metrics_pending": true,
  "dimensions": [
    "semantic_expression",
    "composition",
    "hierarchy",
    "motion",
    "continuity",
    "visual_richness",
    "repetition",
    "ppt_feeling",
    "overall"
  ],
  "corpus": {
    "root": "tests/corpus/real-content",
    "count": 21,
    "categories": {
      "abstract_philosophy": 3,
      "adversarial_repetition": 3,
      "data_comparison": 4,
      "explanation": 4,
      "longform": 3,
      "narrative_emotion": 4
    }
  },
  "cases": [
    {
      "srt": "tests/corpus/real-content/abstract_philosophy/a01-time.srt",
      "category": "abstract_philosophy",
      "production_path": {
        "status": "PASS",
        "stages": [
          "PLANNED",
          "GENERATED",
          "VERIFIED",
          "RENDERED"
        ],
        "next_stage": "EVALUATED",
        "verdict": "UNRESOLVED",
        "work_dir": "../p2-1/candidate/runs/tests__corpus__real-content__abstract_philosophy__a01-time.srt/work"
      },
      "render": {
        "contact_sheet": "contact-tests__corpus__real-content__abstract_philosophy__a01-time.png",
        "bytes": 69814,
        "film_index": "../p2-1/candidate/runs/tests__corpus__real-content__abstract_philosophy__a01-time.srt/film/index.html",
        "film_exists": true
      },
      "machine_metrics": {
        "cues": null,
        "beats": 4,
        "elements": 35,
        "distinct_strategies": 4,
        "strategy_histogram": {
          "single_focus": 1,
          "center_cluster": 1,
          "left_to_right_flow": 1,
          "comparison": 1
        },
        "ink_mean": 0.0709,
        "colors_mean": 48.0,
        "validator_status": "PASS",
        "l4": "PENDING — semantic/visual review must be done by agent or human",
        "anti_ppt": {
          "text_ratio": 0.4,
          "text_dominant_beats": 0,
          "template_repeat": 0.25,
          "max_consecutive_same_strategy": 1,
          "decoration_ratio": 0.0,
          "fade_only_motion_ratio": 0.486,
          "static_beat_ratio": 0.0,
          "encoding_repeat": 0.25,
          "_note": "auxiliary signals only; not a PPT verdict (L4 decides)"
        }
      },
      "scores": {
        "semantic_expression": "PENDING",
        "composition": "PENDING",
        "hierarchy": "PENDING",
        "motion": "PENDING",
        "continuity": "PENDING",
        "visual_richness": "PENDING",
        "repetition": "PENDING",
        "ppt_feeling": "PENDING",
        "overall": "PENDING"
      },
      "verdict": "PENDING",
      "notes": ""
    },
    {
      "srt": "tests/corpus/real-content/abstract_philosophy/a02-freedom.srt",
      "category": "abstract_philosophy",
      "production_path": {
        "status": "PASS",
        "stages": [
          "PLANNED",
          "GENERATED",
          "VERIFIED",
          "RENDERED"
        ],
        "next_stage": "EVALUATED",
        "verdict": "UNRESOLVED",
        "work_dir": "../p2-1/candidate/runs/tests__corpus__real-content__abstract_philosophy__a02-freedom.srt/work"
      },
      "render": {
        "contact_sheet": "contact-tests__corpus__real-content__abstract_philosophy__a02-freedom.png",
        "bytes": 31790,
        "film_index": "../p2-1/candidate/runs/tests__corpus__real-content__abstract_philosophy__a02-freedom.srt/film/index.html",
        "film_exists": true
      },
      "machine_metrics": {
        "cues": null,
        "beats": 2,
        "elements": 15,
        "distinct_strategies": 2,
        "strategy_histogram": {
          "center_cluster": 1,
          "single_focus": 1
        },
        "ink_mean": 0.0867,
        "colors_mean": 48.0,
        "validator_status": "PASS",
        "l4": "PENDING — semantic/visual review must be done by agent or human",
        "anti_ppt": {
          "text_ratio": 0.4,
          "text_dominant_beats": 0,
          "template_repeat": 0.5,
          "max_consecutive_same_strategy": 1,
          "decoration_ratio": 0.0,
          "fade_only_motion_ratio": 0.467,
          "static_beat_ratio": 0.0,
          "encoding_repeat": 0.5,
          "_note": "auxiliary signals only; not a PPT verdict (L4 decides)"
        }
      },
      "scores": {
        "semantic_expression": "PENDING",
        "composition": "PENDING",
        "hierarchy": "PENDING",
        "motion": "PENDING",
        "continuity": "PENDING",
        "visual_richness": "PENDING",
        "repetition": "PENDING",
        "ppt_feeling": "PENDING",
        "overall": "PENDING"
      },
      "verdict": "PENDING",
      "notes": ""
    },
    {
      "srt": "tests/corpus/real-content/abstract_philosophy/a03-paradox.srt",
      "category": "abstract_philosophy",
      "production_path": {
        "status": "PASS",
        "stages": [
          "PLANNED",
          "GENERATED",
          "VERIFIED",
          "RENDERED"
        ],
        "next_stage": "EVALUATED",
        "verdict": "UNRESOLVED",
        "work_dir": "../p2-1/candidate/runs/tests__corpus__real-content__abstract_philosophy__a03-paradox.srt/work"
      },
      "render": {
        "contact_sheet": "contact-tests__corpus__real-content__abstract_philosophy__a03-paradox.png",
        "bytes": 44571,
        "film_index": "../p2-1/candidate/runs/tests__corpus__real-content__abstract_philosophy__a03-paradox.srt/film/index.html",
        "film_exists": true
      },
      "machine_metrics": {
        "cues": null,
        "beats": 3,
        "elements": 24,
        "distinct_strategies": 3,
        "strategy_histogram": {
          "left_to_right_flow": 1,
          "center_cluster": 1,
          "single_focus": 1
        },
        "ink_mean": 0.0777,
        "colors_mean": 48.0,
        "validator_status": "PASS",
        "l4": "PENDING — semantic/visual review must be done by agent or human",
        "anti_ppt": {
          "text_ratio": 0.333,
          "text_dominant_beats": 0,
          "template_repeat": 0.333,
          "max_consecutive_same_strategy": 1,
          "decoration_ratio": 0.0,
          "fade_only_motion_ratio": 0.5,
          "static_beat_ratio": 0.0,
          "encoding_repeat": 0.333,
          "_note": "auxiliary signals only; not a PPT verdict (L4 decides)"
        }
      },
      "scores": {
        "semantic_expression": "PENDING",
        "composition": "PENDING",
        "hierarchy": "PENDING",
        "motion": "PENDING",
        "continuity": "PENDING",
        "visual_richness": "PENDING",
        "repetition": "PENDING",
        "ppt_feeling": "PENDING",
        "overall": "PENDING"
      },
      "verdict": "PENDING",
      "notes": ""
    },
    {
      "srt": "tests/corpus/real-content/adversarial_repetition/r01-number-list.srt",
      "category": "adversarial_repetition",
      "production_path": {
        "status": "PASS",
        "stages": [
          "PLANNED",
          "GENERATED",
          "VERIFIED",
          "RENDERED"
        ],
        "next_stage": "EVALUATED",
        "verdict": "UNRESOLVED",
        "work_dir": "../p2-1/candidate/runs/tests__corpus__real-content__adversarial_repetition__r01-number-list.srt/work"
      },
      "render": {
        "contact_sheet": "contact-tests__corpus__real-content__adversarial_repetition__r01-number-list.png",
        "bytes": 45044,
        "film_index": "../p2-1/candidate/runs/tests__corpus__real-content__adversarial_repetition__r01-number-list.srt/film/index.html",
        "film_exists": true
      },
      "machine_metrics": {
        "cues": null,
        "beats": 3,
        "elements": 25,
        "distinct_strategies": 3,
        "strategy_histogram": {
          "single_focus": 1,
          "left_to_right_flow": 1,
          "center_cluster": 1
        },
        "ink_mean": 0.076,
        "colors_mean": 48.0,
        "validator_status": "PASS",
        "l4": "PENDING — semantic/visual review must be done by agent or human",
        "anti_ppt": {
          "text_ratio": 0.32,
          "text_dominant_beats": 0,
          "template_repeat": 0.333,
          "max_consecutive_same_strategy": 1,
          "decoration_ratio": 0.0,
          "fade_only_motion_ratio": 0.52,
          "static_beat_ratio": 0.0,
          "encoding_repeat": 0.333,
          "_note": "auxiliary signals only; not a PPT verdict (L4 decides)"
        }
      },
      "scores": {
        "semantic_expression": "PENDING",
        "composition": "PENDING",
        "hierarchy": "PENDING",
        "motion": "PENDING",
        "continuity": "PENDING",
        "visual_richness": "PENDING",
        "repetition": "PENDING",
        "ppt_feeling": "PENDING",
        "overall": "PENDING"
      },
      "verdict": "PENDING",
      "notes": ""
    },
    {
      "srt": "tests/corpus/real-content/adversarial_repetition/r02-repetitive-structure.srt",
      "category": "adversarial_repetition",
      "production_path": {
        "status": "PASS",
        "stages": [
          "PLANNED",
          "GENERATED",
          "VERIFIED",
          "RENDERED"
        ],
        "next_stage": "EVALUATED",
        "verdict": "UNRESOLVED",
        "work_dir": "../p2-1/candidate/runs/tests__corpus__real-content__adversarial_repetition__r02-repetitive-structure.srt/work"
      },
      "render": {
        "contact_sheet": "contact-tests__corpus__real-content__adversarial_repetition__r02-repetitive-structure.png",
        "bytes": 42375,
        "film_index": "../p2-1/candidate/runs/tests__corpus__real-content__adversarial_repetition__r02-repetitive-structure.srt/film/index.html",
        "film_exists": true
      },
      "machine_metrics": {
        "cues": null,
        "beats": 3,
        "elements": 25,
        "distinct_strategies": 3,
        "strategy_histogram": {
          "single_focus": 1,
          "left_to_right_flow": 1,
          "center_cluster": 1
        },
        "ink_mean": 0.0778,
        "colors_mean": 47.7,
        "validator_status": "PASS",